[
  {
    "id": "enne-jeho",
    "names": {
      "en": "En'ne Jeho",
      "ja": "鉛音ジェホ"
    },
    "owners": [
      "KougaP"
    ],
    "authors": [
      "KougaP"
    ],
    "variants": [
      {
        "id": "enne-jeho-cvvc",
        "names": {
          "en": "En'ne Jeho",
          "ja": "鉛音ジェホ"
        },
        "file_url": null,
        "download_page_url": "https://drive.google.com/file/d/1s-MAlQjaEppw6gyY6kOxG1KadabSN56d/view?usp=drive_link",
        "tags": [
          "utau",
          "japanese",
          "cvvc"
        ]
      }
    ],
    "homepage_url": "https://headhunter4621.github.io/singers/en'ne-jeho/",
    "profile_image_url": "https://i.imgur.com/Fzn9vhe.png"
  }
]
